date,time,Event ID,Event Name,Play day,Start hour,Home Team,Away Team,Beide teams zullen scoren Ja,Beide teams zullen scoren Nee,Wedstrijduitslag 1,Wedstrijduitslag Gelijkspel,Wedstrijduitslag 2,Totaal Aantal Goals Meer dan (2.5),Totaal Aantal Goals Onder (2.5)
29 Feb. 2024,10:25,1-24168696,KVC Westerlo vs Royal Charleroi SC,01 Mar. 2024,19:45,KVC Westerlo,Royal Charleroi SC,1.73,2.10,2.03,3.47,3.66,1.87,1.93
29 Feb. 2024,10:25,1-24174308,Cercle Brugge KSV vs KV Mechelen,02 Mar. 2024,15:00,Cercle Brugge KSV,KV Mechelen,1.74,2.09,1.87,3.58,3.91,1.83,1.97
29 Feb. 2024,10:25,1-24174753,Oud-Heverlee Leuven vs Royale Union Saint-Gilloise,02 Mar. 2024,17:15,Oud-Heverlee Leuven,Royale Union Saint-Gilloise,1.81,2.00,5.30,4.40,1.52,1.68,2.18
29 Feb. 2024,10:25,1-24175130,Standard Liege vs KAA Gent,02 Mar. 2024,19:45,Standard Liege,KAA Gent,1.74,2.09,3.10,3.38,2.22,1.92,1.88
29 Feb. 2024,10:25,1-24179747,KRC Genk vs Club Brugge,03 Mar. 2024,12:30,KRC Genk,Club Brugge,1.61,2.32,2.99,3.52,2.21,1.72,2.12
29 Feb. 2024,10:25,1-24180474,Royal Antwerp FC vs Sint Truidense VV,03 Mar. 2024,15:00,Royal Antwerp FC,Sint Truidense VV,1.82,1.98,1.64,3.93,4.90,1.80,2.01
29 Feb. 2024,10:25,1-24180932,RSC Anderlecht vs KAS Eupen,03 Mar. 2024,17:30,RSC Anderlecht,KAS Eupen,2.04,1.74,1.32,5.30,8.30,1.62,2.30
29 Feb. 2024,10:25,1-24181067,KV Kortrijk vs RWD Molenbeek 47,03 Mar. 2024,18:15,KV Kortrijk,RWD Molenbeek 47,1.68,2.05,2.42,3.33,2.81,1.91,1.89
